A1: Class 3
A2: Boat | B2: Type of Boat | C2: TCC | D2: Points | E2: Sans 9 | F2: Sans 9 et 5 | G2: 1 | H2: 2 | I2: 3 | J2: 4 | K2: 5 | L2: 6 | M2: 7 | N2: 8 | O2: 9
A3: Batistyl | B3: A 35 | C3: 1.0269999999999999 | D3: 24 | E3: =D3-O3 -> 22 | F3: =E3-K3 -> 13 | G3: 1 | H3: 1.5 | I3: 3.5 | J3: 3 | K3: 9 | L3: 1 | M3: 2 | N3: 1 | O3: 2
A4: Antix | B4: Corby 35 | C4: 1.034 | D4: 34 | E4: =D4-O4 -> 16 | F4: =E4-K4 -> 14 | G4: 0.5 | H4: 2 | I4: 2 | J4: 0.5 | K4: 2 | L4: 5.5 | M4: 0.5 | N4: 3 | O4: 18
A5: No Naked Flames | B5: J 109 | C5: 1.0329999999999999 | D5: 36 | E5: =D5-O5 -> 14 | F5: =E5-K5 -> 13 | G5: 1.5 | H5: 0.5 | I5: 0.5 | J5: 1 | K5: 1 | L5: 5 | M5: 2.5 | N5: 2 | O5: 22
A6: Pen Azen | B6: J 109 | C6: 1.0329999999999999 | D6: 37 | E6: =D6-O6 -> 21 | F6: =E6-K6 -> 18 | G6: 2.5 | H6: 1 | I6: 3 | J6: 1.5 | K6: 3 | L6: 4 | M6: 1 | N6: 5 | O6: 16
A7: Quokka | B7: Elan 37 | C7: 1.0349999999999999 | D7: 40 | E7: =D7-O7 -> 34 | F7: =E7-K7 -> 26 | G7: 3.5 | H7: 4.5 | I7: 1.5 | J7: 3.5 | K7: 8 | L7: 2 | M7: 5 | N7: 6 | O7: 6
A8: No Doubt | B8: First 34.7 | C8: 1.018 | D8: 41.75 | E8: =D8-O8 -> 37.75 | F8: =E8-K8 -> 26.75 | G8: 4.75 | H8: 4 | I8: 5 | J8: 2.5 | K8: 11 | L8: 6 | M8: 3 | N8: 1.5 | O8: 4
A9: Checkmate | B9: Ker 32 | C9: 1.038 | D9: 42 | E9: =D9-O9 -> 22 | F9: =E9-K9 -> 18 | G9: 2 | H9: 3 | I9: 1 | J9: 5 | K9: 4 | L9: 3 | M9: 1.5 | N9: 2.5 | O9: 20
A10: TBS | B10: First 34.7 | C10: 1.0109999999999999 | D10: 43 | E10: =D10-O10 -> 31 | F10: =E10-K10 -> 25 | G10: 3 | H10: 3.5 | I10: 2.5 | J10: 4 | K10: 6 | L10: 4.5 | M10: 4 | N10: 3.5 | O10: 12
A11: Civils with Flair | B11: Elan 40 | C11: 1.0389999999999999 | D11: 45.25 | E11: =D11-O11 -> 37.25 | F11: =E11-K11 -> 30.25 | G11: 4.75 | H11: 6.5 | I11: 4.5 | J11: 2 | K11: 7 | L11: 1.5 | M11: 5.5 | N11: 5.5 | O11: 8
A12: Swisslife | B12: Grand Soleil 37 | C12: 1.0289999999999999 | D12: 47 | E12: =D12-O12 -> 33 | F12: =E12-K12 -> 28 | G12: 5.5 | H12: 5.5 | I12: 6.5 | J12: 6 | K12: 5 | L12: 0.5 | M12: 3.5 | N12: 0.5 | O12: 14
A13: Ship Shop Aquaholic | B13: First 34.7 | C13: 1.016 | D13: 50 | E13: =D13-O13 -> 40 | F13: =E13-K13 -> 30 | G13: 6 | H13: 2.5 | I13: 4 | J13: 5.5 | K13: 10 | L13: 3.5 | M13: 4.5 | N13: 4 | O13: 10
A14: Salamander XVIII | B14: Bavaria Match 38 | C14: 1.0389999999999999 | D14: 69.5 | E14: =D14-O14 -> 45.5 | F14: =E14-K14 -> 36.5 | G14: 6.5 | H14: 5 | I14: 5.5 | J14: 6.5 | K14: 9 | L14: 2.5 | M14: 6 | N14: 4.5 | O14: 24
A15: Zarafa | B15: HOD 35 | C15: 1.036 | D15: 80.5 | E15: =D15-O15 -> 52.5 | F15: =E15-K15 -> 40.5 | G15: 4 | H15: 6 | I15: 6 | J15: 4.5 | K15: 12 | L15: 6.5 | M15: 6.5 | N15: 7 | O15: 28