A1: Class 2
A2: Boat | B2: Type of Boat | C2: TCC | D2: Points | E2: Sans 9 | F2: Sans 9 et 5 | G2: 1 | H2: 2 | I2: 3 | J2: 4 | K2: 5 | L2: 6 | M2: 7 | N2: 8 | O2: 9
A3: Paprec Recyclage | B3: Sinergia 40 | C3: 1.0940000000000001 | D3: 23 | E3: =D3-O3 -> 19 | F3: =E3-K3 -> 10 | G3: 1.5 | H3: 2 | I3: 2.5 | J3: 1 | K3: 9 | L3: 1 | M3: 1 | N3: 1 | O3: 4
A4: Marinerscove.ie 2 | B4: Mills 39 | C4: 1.1040000000000001 | D4: 29 | E4: =D4-O4 -> 9 | F4: =E4-K4 -> 8 | G4: 0.5 | H4: 0.5 | I4: 1 | J4: 2 | K4: 1 | L4: 0.5 | M4: 0.5 | N4: 3 | O4: 20
A5: Guyader L'Esprit de la Mer | B5: JPK 10.9 | C5: 1.044 | D5: 30 | E5: =D5-O5 -> 28 | F5: =E5-K5 -> 24 | G5: 3.5 | H5: 6 | I5: 2 | J5: 6.5 | K5: 4 | L5: 1.5 | M5: 3 | N5: 1.5 | O5: 2
A6: Blondie | B6: Corby 35 | C6: 1.087 | D6: 37.5 | E6: =D6-O6 -> 15.5 | F6: =E6-K6 -> 13.5 | G6: 1 | H6: 1 | I6: 1.5 | J6: 0.5 | K6: 2 | L6: 7.5 | M6: 1.5 | N6: 0.5 | O6: 22
A7: Juga | B7: Sinergia 40 | C7: 1.0960000000000001 | D7: 41.5 | E7: =D7-O7 -> 35.5 | F7: =E7-K7 -> 29.5 | G7: 6.5 | H7: 4 | I7: 5 | J7: 1.5 | K7: 6 | L7: 4.5 | M7: 3.5 | N7: 4.5 | O7: 6
A8: Software Mistress | B8: Ker 36 | C8: 1.09 | D8: 43.5 | E8: =D8-O8 -> 35.5 | F8: =E8-K8 -> 25.5 | G8: 5.5 | H8: 3.5 | I8: 4.5 | J8: 4.5 | K8: 10 | L8: 3 | M8: 2 | N8: 2.5 | O8: 8
A9: Oxygen | B9: IMX 40 | C9: 1.075 | D9: 46.5 | E9: =D9-O9 -> 34.5 | F9: =E9-K9 -> 27.5 | G9: 2.5 | H9: 5.5 | I9: 5.5 | J9: 4 | K9: 7 | L9: 2 | M9: 6 | N9: 2 | O9: 12
A10: Jump Juice | B10: Ker 37 | C10: 1.1020000000000001 | D10: 48.5 | E10: =D10-O10 -> 32.5 | F10: =E10-K10 -> 29.5 | G10: 2 | H10: 4.5 | I10: 0.5 | J10: 6 | K10: 3 | L10: 7.5 | M10: 5 | N10: 4 | O10: 16
A11: Roark | B11: Grand Soleil 43 | C11: 1.1040000000000001 | D11: 49.5 | E11: =D11-O11 -> 31.5 | F11: =E11-K11 -> 26.5 | G11: 4.5 | H11: 2.5 | I11: 4 | J11: 3 | K11: 5 | L11: 5 | M11: 2.5 | N11: 5 | O11: 18
A12: Aon | B12: X 43 | C12: 1.1 | D12: 50 | E12: =D12-O12 -> 40 | F12: =E12-K12 -> 32 | G12: 4 | H12: 3 | I12: 6 | J12: 5 | K12: 8 | L12: 3.5 | M12: 4 | N12: 6.5 | O12: 10
A13: Mankie | B13: IMX 40 | C13: 1.093 | D13: 60 | E13: =D13-O13 -> 36 | F13: =E13-K13 -> 25 | G13: 3 | H13: 1.5 | I13: 3.5 | J13: 3.5 | K13: 11 | L13: 2.5 | M13: 5.5 | N13: 5.5 | O13: 24
A14: Absolutely II | B14: Mumm 36 | C14: 1.0760000000000001 | D14: 61.5 | E14: =D14-O14 -> 47.5 | F14: =E14-K14 -> 38.5 | G14: 6 | H14: 6.5 | I14: 3 | J14: 5.5 | K14: 9 | L14: 7.5 | M14: 6.5 | N14: 3.5 | O14: 14
A15: Maverick 2 | B15: IMX 40 | C15: 1.0940000000000001 | D15: 71.5 | E15: =D15-O15 -> 45.5 | F15: =E15-K15 -> 33.5 | G15: 5 | H15: 5 | I15: 6.5 | J15: 2.5 | K15: 12 | L15: 4 | M15: 4.5 | N15: 6 | O15: 26