A1: Class 1
A2: Boat | B2: Type of Boat | C2: TCC | D2: Points | E2: Sans 9 | F2: Sans 9 et 5 | G2: 1 | H2: 2 | I2: 3 | J2: 4 | K2: 5 | L2: 6 | M2: 7 | N2: 8 | O2: 9
A3: Fair Do's VII | B3: Ker 46 | C3: 1.1870000000000001 | D3: 19.5 | E3: =D3-O3 -> 11.5 | F3: =E3-K3 -> 9.5 | G3: 0.5 | H3: 1.5 | I3: 1.5 | J3: 0.5 | K3: 2 | L3: 1.5 | M3: 1.5 | N3: 2.5 | O3: 8
A4: Tiamat | B4: Mills 40 | C4: 1.1419999999999999 | D4: 25 | E4: =D4-O4 -> 19 | F4: =E4-K4 -> 13 | G4: 3.5 | H4: 2.5 | I4: 1 | J4: 1 | K4: 6 | L4: 2 | M4: 1 | N4: 2 | O4: 6
A5: Courrier du Coeur | B5: First 44.7 | C5: 1.11 | D5: 29 | E5: =D5-O5 -> 25 | F5: =E5-K5 -> 15 | G5: 3 | H5: 4.5 | I5: 2 | J5: 2.5 | K5: 10 | L5: 1 | M5: 0.5 | N5: 1.5 | O5: 4
A6: Bear of Britain | B6: Farr 52 | C6: 1.32 | D6: 32 | E6: =D6-O6 -> 18 | F6: =E6-K6 -> 15 | G6: 1.5 | H6: 0.5 | I6: 3.5 | J6: 1.5 | K6: 3 | L6: 4 | M6: 3.5 | N6: 0.5 | O6: 14
A7: Magic Glove | B7: Ker 50 | C7: 1.2769999999999999 | D7: 35 | E7: =D7-O7 -> 15 | F7: =E7-K7 -> 14 | G7: 1 | H7: 1 | I7: 0.5 | J7: 2 | K7: 1 | L7: 2.5 | M7: 2 | N7: 5 | O7: 20
A8: Codiam ENSP dh | B8: IMX 45 | C8: 1.151 | D8: 42 | E8: =D8-O8 -> 40 | F8: =E8-K8 -> 30 | G8: 4.5 | H8: 4 | I8: 4 | J8: 5 | K8: 10 | L8: 3.5 | M8: 4.5 | N8: 4.5 | O8: 2
A9: Murka 2 | B9: Swan 45 | C9: 1.1910000000000001 | D9: 42.25 | E9: =D9-O9 -> 30.25 | F9: =E9-K9 -> 23.25 | G9: 2.25 | H9: 3 | I9: 2.5 | J9: 4 | K9: 7 | L9: 5 | M9: 2.5 | N9: 4 | O9: 12
A10: Marinerscove.ie 1 | B10: DK 46 | C10: 1.2090000000000001 | D10: 46.25 | E10: =D10-O10 -> 22.25 | F10: =E10-K10 -> 17.25 | G10: 2.25 | H10: 3.5 | I10: 3 | J10: 3 | K10: 5 | L10: 0.5 | M10: 4 | N10: 1 | O10: 24
A11: Exabyte 3 | B11: IMX 45 | C11: 1.1479999999999999 | D11: 55.5 | E11: =D11-O11 -> 45.5 | F11: =E11-K11 -> 37.5 | G11: 5.5 | H11: 5.5 | I11: 6 | J11: 5.5 | K11: 8 | L11: 4.5 | M11: 5 | N11: 5.5 | O11: 10
A12: Chernikeeff 2 | B12: Farr 52 | C12: 1.3149999999999999 | D12: 59.5 | E12: =D12-O12 -> 33.5 | F12: =E12-K12 -> 29.5 | G12: 4 | H12: 2 | I12: 5.5 | J12: 3.5 | K12: 4 | L12: 5.5 | M12: 6 | N12: 3 | O12: 26
A13: Moana | B13: First 47.7 | C13: 1.125 | D13: 62 | E13: =D13-O13 -> 44 | F13: =E13-K13 -> 33 | G13: 6 | H13: 6 | I13: 4.5 | J13: 4.5 | K13: 11 | L13: 3 | M13: 5.5 | N13: 3.5 | O13: 18
A14: Fatboy | B14: Swan 45 | C14: 1.1919999999999999 | D14: 68.5 | E14: =D14-O14 -> 46.5 | F14: =E14-K14 -> 37.5 | G14: 5 | H14: 5 | I14: 6.5 | J14: 6 | K14: 9 | L14: 6 | M14: 3 | N14: 6 | O14: 22
A15: Saga | B15: Nelson Marek 47 | C15: 1.2390000000000001 | D15: 72 | E15: =D15-O15 -> 56 | F15: =E15-K15 -> 44 | G15: 6.5 | H15: 6.5 | I15: 5 | J15: 6.5 | K15: 12 | L15: 6.5 | M15: 6.5 | N15: 6.5 | O15: 16